{
  "schemaVersion": 1,
  "changeName": "redact-private-references",
  "createdAt": "2026-06-08T00:00:00.000Z",
  "proposedAt": "2026-06-08T00:00:00.000Z",
  "reviewedAt": null,
  "reviewWaived": false,
  "appliedAt": null,
  "verifiedAt": null,
  "verifyStatus": null,
  "verifyIterations": 0,
  "lastVerifyReportPath": null,
  "archivedAt": null,
  "prUrl": null,
  "prNumber": null,
  "deferredIssues": [],
  "manualActionIssues": []
}
