{
  "schemaVersion": 1,
  "changeName": "decouple-app-schema-i18n",
  "createdAt": "2026-05-26T00:00:00.000Z",
  "proposedAt": "2026-05-26T00:00:00.000Z",
  "reviewedAt": "2026-05-26T22:03:58Z",
  "reviewWaived": false,
  "reviewWaiveReason": null,
  "appliedAt": "2026-05-26T22:13:35Z",
  "verifiedAt": "2026-05-26T22:31:00Z",
  "verifyStatus": "READY",
  "verifyIterations": 1,
  "lastVerifyReportPath": "verify-report.md",
  "archivedAt": "2026-05-26T22:34:15.962Z",
  "prUrl": "https://github.com/igonzalezespi/a-couple-apps/pull/15",
  "prNumber": 15,
  "deferredIssues": [],
  "manualActionIssues": []
}
