{
  "schemaVersion": 1,
  "changeName": "bootstrap-foundation",
  "createdAt": "2026-05-24T12:00:00.000Z",
  "proposedAt": "2026-05-24T12:00:00.000Z",
  "reviewedAt": null,
  "reviewWaived": true,
  "reviewWaiveReason": "Foundation approved by the maintainer via the Conventions Report + architecture + ROADMAP review (2026-05-24). Formal /osx:review waived: the review tooling is created by this very change (bootstrap).",
  "appliedAt": "2026-05-24T13:00:00.000Z",
  "verifiedAt": "2026-05-26T00:00:00Z",
  "verifyStatus": "READY_WITH_WARNINGS",
  "verifyIterations": 2,
  "lastVerifyReportPath": "verify-report.md",
  "archivedAt": "2026-05-26T21:15:06.483Z",
  "prUrl": "https://github.com/igonzalezespi/a-couple-apps/pull/12",
  "prNumber": 12,
  "deferredIssues": [
    {
      "id": "umbrella-phase8",
      "number": 13,
      "url": "https://github.com/igonzalezespi/a-couple-apps/issues/13",
      "findingId": "umbrella-phase8"
    }
  ],
  "manualActionIssues": []
}
