{
  "schemaVersion": 1,
  "changeName": "movies-tonight-pick",
  "createdAt": "2026-05-26T00:00:00.000Z",
  "proposedAt": "2026-05-26T00:00:00.000Z",
  "reviewedAt": null,
  "reviewWaived": true,
  "reviewWaiveReason": "Maintainer authorized direct autonomous implementation; proposal + design authored and merged this session.",
  "appliedAt": "2026-05-26T13:00:00.000Z",
  "verifiedAt": "2026-05-26T20:37:36Z",
  "verifyStatus": "READY_WITH_WARNINGS",
  "verifyIterations": 1,
  "lastVerifyReportPath": "verify-report.md",
  "archivedAt": "2026-05-26T21:15:06.483Z",
  "prUrl": "https://github.com/igonzalezespi/a-couple-apps/pull/12",
  "prNumber": 12,
  "deferredIssues": [
    {
      "id": "umbrella-phase8",
      "number": 13,
      "url": "https://github.com/igonzalezespi/a-couple-apps/issues/13",
      "findingId": "umbrella-phase8"
    }
  ],
  "manualActionIssues": []
}
