{
  "schemaVersion": 1,
  "changeName": "apps-movies",
  "createdAt": "2026-05-24T22:10:00.000Z",
  "proposedAt": "2026-05-24T22:10:00.000Z",
  "reviewedAt": null,
  "reviewWaived": false,
  "reviewWaiveReason": null,
  "appliedAt": "2026-05-24T23:30:00.000Z",
  "verifiedAt": "2026-05-26T20:37:44Z",
  "verifyStatus": "READY_WITH_WARNINGS",
  "verifyIterations": 1,
  "lastVerifyReportPath": "verify-report.md",
  "archivedAt": "2026-05-26T21:15:06.483Z",
  "prUrl": "https://github.com/igonzalezespi/a-couple-apps/pull/14",
  "prNumber": 14,
  "deferredIssues": [
    {
      "id": "umbrella-phase8",
      "number": 13,
      "url": "https://github.com/igonzalezespi/a-couple-apps/issues/13",
      "findingId": "umbrella-phase8"
    }
  ],
  "manualActionIssues": []
}
