{
  "schemaVersion": 1,
  "changeName": "decouple-app-schema-i18n",
  "createdAt": "2026-05-26T00:00:00.000Z",
  "proposedAt": "2026-05-26T00:00:00.000Z",
  "reviewedAt": "2026-05-26T22:03:58Z",
  "reviewWaived": false,
  "reviewWaiveReason": null,
  "appliedAt": "2026-05-26T22:13:35Z",
  "verifiedAt": null,
  "verifyStatus": null,
  "verifyIterations": 0,
  "lastVerifyReportPath": null,
  "archivedAt": null,
  "prUrl": null,
  "prNumber": null,
  "deferredIssues": [],
  "manualActionIssues": []
}
