{
  "schemaVersion": 1,
  "changeName": "couple-personalization",
  "createdAt": "2026-05-26T14:00:00.000Z",
  "proposedAt": "2026-05-26T14:00:00.000Z",
  "reviewedAt": null,
  "reviewWaived": true,
  "reviewWaiveReason": "Maintainer confirmed the design (gitignored private config + per-person color) and authorized direct implementation.",
  "appliedAt": "2026-05-26T15:00:00.000Z",
  "verifiedAt": "2026-05-26T20:37:32Z",
  "verifyStatus": "READY_WITH_WARNINGS",
  "verifyIterations": 1,
  "lastVerifyReportPath": "verify-report.md",
  "archivedAt": "2026-05-26T21:15:06.483Z",
  "prUrl": "https://github.com/igonzalezespi/a-couple-apps/pull/14",
  "prNumber": 14,
  "deferredIssues": [
    {
      "id": "umbrella-phase8",
      "number": 13,
      "url": "https://github.com/igonzalezespi/a-couple-apps/issues/13",
      "findingId": "umbrella-phase8"
    }
  ],
  "manualActionIssues": []
}
